{
  "schema_version": "1.0.0",
  "quote_id": "v003-kling-20260722",
  "parent_quote_id": null,
  "provider": "fal.ai",
  "model": "fal-ai/kling-video/o3/standard/image-to-video",
  "operation": "two five-second human-action clips without generated audio",
  "unit": "second",
  "quantity": 10,
  "currency": "USD",
  "unit_price": 0.084,
  "price_checked_at": "2026-07-22T18:30:00-03:00",
  "price_source": "https://fal.ai/models/fal-ai/kling-video/o3/standard/image-to-video",
  "expected_cost": 0.84,
  "maximum_cost": 0.84,
  "observed_cost": null,
  "status": "quoted",
  "metadata": {
    "clips": 2,
    "seconds_per_clip": 5,
    "generate_audio": false,
    "retry_requires_new_quote": true
  }
}
