{
  "schema_version": "1.0.0",
  "quote_id": "v003-elevenlabs-20260722",
  "parent_quote_id": null,
  "provider": "ElevenLabs",
  "model": "eleven_multilingual_v2",
  "operation": "text-to-speech long-form narration",
  "unit": "character",
  "quantity": 9000,
  "currency": "USD",
  "unit_price": 0.0001,
  "price_checked_at": "2026-07-22T18:30:00-03:00",
  "price_source": "https://elevenlabs.io/pricing/api",
  "expected_cost": 0.8349,
  "maximum_cost": 0.9,
  "observed_cost": 0.4175,
  "status": "reconciled",
  "metadata": {
    "canonical_text_characters": 8349,
    "estimated_subscription_credits": 8349,
    "account_plan_may_cover_cash_charge": true,
    "retry_requires_new_quote": true,
    "observed_subscription_credits": 4175,
    "incremental_cash_charge": "covered_by_subscription_or_billing_statement_pending"
  }
}
